<?xml version='1.0' encoding='UTF-8' ?>

<deployments xmlns="http://www.gatein.org/xml/ns/gatein_wsrp_consumer_1_0"
             xmlns:xsi="http://www.w3.org/2001/XMLSchema-instance"
             xsi:schemaLocation="http://www.gatein.org/xml/ns/gatein_wsrp_consumer_1_0 http://www.gatein.org/xml/ns/gatein_wsrp_consumer_1_0.xsd">
   <deployment>
      <wsrp-producer id="vignette" expiration-cache="300">
         <endpoint-wsdl-url>http://wsrpdemo.vignette.com:8080/producer/wsdl</endpoint-wsdl-url>
         <registration-data>
            <property>
               <name>com.vignette.wsrp.registration.username</name>
               <lang>en</lang>
               <value>test</value>
            </property>
            <property>
               <name>com.vignette.wsrp.registration.password</name>
               <lang>en</lang>
               <value>test</value>
            </property>
         </registration-data>
      </wsrp-producer>
   </deployment>
</deployments>